sentences,aos
wasn't going to share but i feel obligated...while sitting at the sushi bar dining we watched the chef accidentally drop a piece of unagi on the floor and upon retrieving it from the floor proceed to use the piece in the delivery order he was preparing.,"[([17], [], -1)]"
"this place which is only a few months old, is perhaps queens' biggest secret!","[([1], [], 1)]"
"fabulous decor - makes you feel like you're in a trendy manhattan restaurant, very very good food cheaply-priced, generally friendly s staff and if you're a manhattanite, or spend most of your time in manhattan, rice avenue will make you feel at home.....very soho/village/upper west side minus the expensive prices and pretentious clientele.....all on roosevelt avenue!","[([1], [], 1), ([16], [], 1), ([16], [], 1), ([21], [], 1), ([35, 36], [], 1), ([35, 36], [], 1), ([35, 36], [], 1)]"
we were seated outside and the waiter spilled red wine and hot tea on myself and my date.,"[([6], [], -1)]"
"one would think we'd get an apology or complimentary drinks - instead, we got a snobby waiter wouldn't even take our order for 15 minutes and gave us lip when we asked him to do so.","[([16], [], -1)]"
"with so many good restaurants on the uws, i don't need overpriced food absurdly arrogant w wait-staff ho don't recognize they work at a glorified diner, clumsy service and m management hat doesn't care.","[([12], [], -1), ([16], [], -1), ([27], [], -1), ([30], [], -1)]"
i am relatively new to the area and tried pick a bgel on 2nd and was disappointed with the service and i thought the food was overated and on the pricey side.,"[([19], [], -1), ([24], [], -1), ([24], [], -1)]"
the food is okay and the prices here are mediocre.,"[([1], [], 0)]"
baluchi's has solid food and a nice decor at reasonable prices.,"[([3], [], 1), ([7], [], 1), ([0], [], 1)]"
the only problem is that the manager is a complete incompetent.,"[([6], [], -1)]"
he offers subpar service and has no personality.,"[([3], [], -1)]"
there is no excuse for such lousy service,"[([7], [], -1)]"
i have never before eaten 40 pieces of relatively good nigiri,"[([10], [], 0)]"
$20 for all you can eat sushi cannot be beaten.,"[([2, 3, 4, 5, 6], [], 1)]"
"i went to areo on a sunday afternoon with four of my girlfriends, and spent three enjoyable hours there.","[([3], [], 1)]"
"most of the servers are very attentive, friendly and quite attractive.","[([3], [], 1)]"
"the vibe is very relaxed and cozy, service was great and the food was excellent!","[([1], [], 1), ([7], [], 1), ([12], [], 1)]"
food was good and the view of the new york city skiline was terrific even on a foggy rainy day like that of when i went.,"[([0], [], 1), ([5, 6, 7, 8, 9, 10, 11], [], 1)]"
i would highly recommand requesting a table by the window,"[([6, 7, 8, 9], [], 1)]"
although they do the typical what kind of water would you like questions the service was good and overall very relaxing to place to eat.,"[([14], [], 1), ([22], [], 1)]"
the food is great.,"[([1], [], 1)]"
personal pans are the perfect size for those hungry nights.,"[([0, 1], [], 1)]"
there is a downside if you're ordering in -- the delivery guys have major attitude.,"[([10, 11], [], -1)]"
never have i had such dramatic delivery guys (a lot of huffing and panting and muttering under breath b/c i live in a walkup) who always seem disappointed with their tips.,"[([6, 7], [], -1)]"
"love the scene first off- the place has a character and nice light to it..very fortunate, location wise.","[([2], [], 1), ([6], [], 1), ([16], [], 1)]"
the pizza was pretty good and huge.,"[([1], [], 1), ([1], [], 1)]"
we were 4 and got the family size penne a la vodka which was tremendously gigantic portion...a bucket of food literally.,"[([8, 9, 10, 11], [], 1)]"
"the pasta penne was pretty extra buttery, creamy which means a big task to diggest.. tasty at first but i would say that i was full with a slice of pizza and 7 to count, penne...got a little moody afterwards cause was stuffed...lol","[([1, 2], [], -1), ([1, 2], [], -1)]"
"la rosa waltzes in, and i think they are doing it the best.","[([0, 1], [], 1)]"
"interesting selection good wines s service ine, fun decor","[([3], [], 1), ([5], [], 1), ([8], [], 1), ([1], [], 1)]"
"i found it on a cold night, the perfect spot to warm up.","[([9], [], 1)]"
i recieved prompt service with a smile.,"[([3], [], 1)]"
this place blew me away...by far my new favorite restaurant on the uppereast side.,"[([1], [], 1)]"
the wine list is extensive and impressive.,"[([1, 2], [], 1)]"
love the atmosphere - felt like i was in paris.,"[([2], [], 1)]"
the mussels were fantastic and so was the dessert ..definitely going to be back very soon.,"[([1], [], 1), ([8], [], 1)]"
i have been coming here for years and have nothing but good things to say about the service and the great staff at la lanterna.,"[([17], [], 1), ([21], [], 1)]"
"over the years the host vittorio, and his c crew have always treated me as family--although with all the business this not-so-little gem does, it amazing he's even able to remember a consistent but not-so-frequent visitor.","[([4], [], 1), ([9], [], 1)]"
i've also been amazed at all the new additions in the past few years: a new jazz bar the most fantastic dining garden the best th thin crust pizzas nd now a l lasagna menu hich is to die for (these are not your average lasagnas)!,"[([21, 22], [], 1), ([16, 17], [], 1), ([26, 27, 28], [], 1), ([33, 34], [], 1)]"
i love this place,"[([3], [], 1)]"
i have to say i have never had a disapointing meal here.,"[([10], [], 1)]"
we could have made a meal of the yummy dumplings from the dumpling menu.,"[([9], [], 1)]"
luckily we saved room for the bbq salmon s sea bass nd crispy duck,"[([6, 7], [], 1), ([9, 10], [], 1), ([12, 13], [], 1)]"
