sentences,aos
"the food is outstanding and the service is quick, friendly and very professional.","[([1], [], 1), ([6], [], 1)]"
always a nice crowd but never loud.,"[([3], [], 1)]"
i am reluctant to write because i would not want my jem of a pizza place to become overcrowded.,"[([14, 15], [], 1)]"
"by far, the best pizza in manhattan.","[([4], [], 1)]"
"the crust is thin, the ingredients are fresh and the staff is friendly.","[([1], [], 1), ([10], [], 1), ([5], [], 1)]"
the menu has so many fish items and oysters.,"[([1], [], 1)]"
"the fish was really,really fresh.","[([1], [], 1)]"
we all agreed that mare is one of the best seafood restaurants in new york.,"[([4], [], 1)]"
i stumbled upon this great pizzeria as i explored my new neighborhood.,"[([5], [], 1)]"
all of the pizzas are terrific and the price is even better!,"[([3], [], 1)]"
i highly recommend the sophia pizza,"[([4, 5], [], 1)]"
the food was mediocre at best but it was the horrible service that made me vow never to go back.,"[([1], [], -1), ([11], [], -1)]"
"immediately after we paid, the waiter took the money and said, okay, you guys are outta here.","[([5], [], -1)]"
for the people who want great food plus great service roxy is a place to avoid!,"[([6], [], -1), ([9], [], -1)]"
"the first time the sushi was outstanding, the second time it was a little bland.","[([4], [], 1), ([4], [], -1)]"
"the blond wood decor is very soothing, the premium sake is excellent and the service is great.","[([1, 2, 3], [], 1), ([8, 9], [], 1), ([14], [], 1)]"
mizu is the japenese find in grammercy.,"[([0], [], 1)]"
"while their kitchen food is delicious, their sushi is out of this world.","[([2, 3], [], 1), ([7], [], 1)]"
mizu is home to creative and unique rolls not to found anywhere else.,"[([7], [], 1)]"
"not only is the cuisine the best around, the service has always been attentive and charming.","[([4], [], 1), ([9], [], 1)]"
warning: you may find it difficult to dine at other japanese restaurants after a visit to mizu,"[([16], [], 1)]"
"thalia is a beautiful restaurant with beautiful people serving you, but the food doesn't quite match up.","[([7], [], 1), ([12], [], -1), ([0], [], 1)]"
i ordered the smoked salmon and roe appetizer and it was off flavor.,"[([3, 4, 5, 6, 7], [], -1)]"
"the entree was bland and small, dessert was not inspired.","[([1], [], -1), ([1], [], -1), ([6], [], -1)]"
i expected quite a bit more from such an expensive menu,"[([10], [], -1), ([10], [], -1)]"
"the view is spectacular, and the food is great.","[([1], [], 1), ([6], [], 1)]"
wonderful strawberry daiquiries as well!,"[([1, 2], [], 1)]"
authentic taiwanese food that's cheap... what more could you ask for?,"[([1, 2], [], 1), ([1, 2], [], 1)]"
the cold appetizer dishes taste like the way i remember them to taste when i was growing up in taiwan.,"[([1, 2, 3], [], 1)]"
delicious simple food in nice outdoor atmosphere,"[([2], [], 1), ([2], [], 1), ([5, 6], [], 1)]"
"kind, attentive wait staff","[([2, 3], [], 1)]"
i really like both the scallops and the mahi mahi (on saffron risotto yum!).,"[([5], [], 1), ([8, 9, 10, 11, 12], [], 1)]"
my friend devoured her chicken and mashed potatos,"[([4, 5, 6, 7], [], 1)]"
delicious crab cakes too.,"[([1, 2], [], 1)]"
"even if the food wasn't this good, the garden is a great place to sit outside and relax.","[([8], [], 1), ([3], [], 1)]"
great neighborhood joint,"[([2], [], 1)]"
this is a nice pizza place with good selection of thin crust pizza including the basil slice,"[([8, 9, 10, 11, 12], [], 1), ([8, 9, 10, 11, 12], [], 1), ([4, 5], [], 1), ([15, 16], [], 1)]"
"their calzones are horrific, bad, vomit-inducing, yuck.","[([1], [], -1)]"
the counter service is bad.,"[([1, 2], [], -1)]"
no pizza 33 for me!,"[([1, 2], [], -1)]"
"the dosas are skimpy, unattractive and drip with grease, and personally i'd drink popcorn topping before i'd eat another one of these.","[([1], [], -1), ([1], [], -1)]"
"the sandwiches are dry, tasteless and way overpriced.","[([1], [], -1), ([1], [], -1)]"
"calling the place hampton chutney co. does warn you that these folks offer more style than substance, but in this unattractive room with unhelpful clerks there was a dearth of the former too.","[([2], [], -1), ([21], [], -1), ([24], [], -1)]"
"seriously, this place kicks ass.","[([2], [], 1)]"
"the atmosphere is unheralded, the service impecible, and the food magnificant.","[([1], [], 1), ([5], [], 1), ([9], [], 1)]"
"best italian food i ever had (and being italian, that means alot).","[([1, 2], [], 1)]"
"this is such a lovely, peaceful place to eat outside.","[([6], [], 1)]"
the restaurant looks out over beautiful green lawns to the hudson river and the statue of liberty.,"[([1], [], 1)]"
"the food is good, especially their more basic dishes and the d drinks re delicious.","[([1], [], 1), ([7, 8], [], 1), ([12], [], 1)]"
"this is a great place to take out-of-towners, and perfect for watching the sunset.","[([4], [], 1)]"
great sushi experience.,"[([1], [], 1)]"
unique apppetizers,"[([1], [], 1)]"
try sushimi cucumber roll,"[([1, 2, 3], [], 1)]"
good spreads great b beverage selections nd bagels really tasty.,"[([1], [], 1), ([4, 5], [], 1), ([7], [], 1)]"
but who says murray's is anything about service,"[([7], [], -1)]"
the service is awful.,"[([1], [], -1)]"
this place is not worth the prices.,"[([1], [], -1), ([1], [], -1)]"
love pizza 33 .,"[([1, 2], [], 1)]"
i will be out with friends and all of a sudden i am hungry and i only crave one thing... their pizza,"[([21], [], 1)]"
this tiny williamsburg spot is always pleasantly surprising.,"[([2, 3], [], 1)]"
the pizza is delicious and the proprietor is one of the nicest in nyc.,"[([1], [], 1), ([6], [], 1)]"
the cream cheeses are out of this world and i love that coffee !,"[([1, 2], [], 1), ([12], [], 1)]"
"bagels are ok, but be sure not to make any special requests!","[([0], [], 0)]"
i asked for an open faced cheese sandwich and the manager basically told me to take my business elsewhere!,"[([10], [], -1)]"
be sure not to get anything other than bagels ..,"[([8], [], 1)]"
the turkey burgers are scary!,"[([1, 2], [], -1)]"
the soup for the udon was soy sauce and water.,"[([1, 2, 3, 4], [], -1)]"
the sushi was awful!,"[([1], [], -1)]"
the rice was poor quality and was cooked so badly it was hard.,"[([1], [], -1)]"
"furthermore, the rice had no seasoning, so the sushi was bland and disgusting.","[([2], [], -1), ([8], [], -1)]"
"the fish was adequate, but inexpertly sliced.","[([1], [], -1)]"
it is obvious that no one in the restaurant has any idea about or experience with japanese cuisine,"[([16, 17], [], -1)]"
"good, fast service","[([2], [], 1)]"
food is great and inexpensive.,"[([0], [], 1), ([0], [], 1)]"
the location is perfect.,"[([1], [], 1)]"
"well, this place is so ghetto its not even funny.","[([2], [], -1)]"
if you like your music blasted and the system isnt that great and if you want to pay at least 100 dollar bottle minimun then you'll love it here.,"[([22], [], -1), ([4], [], -1)]"
awsome pizza especially the margheritta slice,"[([1], [], 1), ([4, 5], [], 1)]"
great atmoshere and worth every bit.,"[([1], [], 1)]"
winnie and her staff are the best crew you can find serving you.,"[([3], [], 1), ([0], [], 1)]"
the food is reliable and the price is moderate.,"[([1], [], 1)]"
for authentic thai food look no further than toons.,"[([2, 3], [], 1)]"
try the pad thai or sample anything on the a appetizer menu .they're all delicious.,"[([2, 3], [], 1), ([10, 11], [], 1)]"
everything about this restaurant was special.,"[([3], [], 1)]"
"the service was attentive, yet discreet.","[([1], [], 1)]"
the brioche and lollies as party favors is a cute and sweet touch to a most memorable meal.,"[([1, 2, 3], [], 1)]"
the place was quiet and delightful.,"[([1], [], 1)]"
service was good and food is wonderful.,"[([0], [], 1), ([4], [], 1)]"
i did not try the caviar but i tried their salmon and crab salad (they are all good),"[([10], [], 1), ([12, 13], [], 1)]"
it is definitely a good spot for snacks and chat.,"[([5], [], 1)]"
"as a retired hipster, i can say with some degree of certainty that for the last year lucky strike has been the best laid-back late night in the city.","[([17, 18], [], 1)]"
"the wait staff is pleasant, fun, and for the most part gorgeous (in the wonderful aesthetic beautification way, not in that she's-way-cuter-than-me-that-b@#$* way).","[([1, 2], [], 1)]"
"the food is yummy, especially their cooked-to-perfection mussels in spicy tomato sauce and their shoestring crispy fries","[([1], [], 1), ([7, 8, 9, 10, 11], [], 1), ([16], [], 1)]"
but the best part about ls is the late night atmosphere delightfully free of the bts.,"[([8, 9, 10], [], 1)]"
you can get a completely delish martini in a glass (that's about 2 1/2 drinks) for $8.50 (i recommend the vanilla shanty mmmm!) in a great homey s setting ith great music,"[([6], [], 1), ([6], [], 1), ([6], [], 1), ([20, 21], [], 1), ([28], [], 1), ([31], [], 1)]"
"the in-house lady dj on saturday nights has outrageously good taste in music, and moreover, takes requests.","[([1, 2, 3], [], 1)]"
you can't go wrong with this place,"[([6], [], 1)]"
suan is a great place that i often take my friends (classmates) too.,"[([0], [], 1)]"
"its location is good and the fact that hutner college is near and their prices are very reasonable, makes students go back to suan again and again.","[([1], [], 1), ([23], [], 1)]"
i love their thai,"[([3], [], 1)]"
noodles with shrimp and chicken and coconut juice is the must!,"[([0, 1, 2, 3, 4, 5, 6, 7], [], 1)]"
i will go back to suan soon!,"[([5], [], 1)]"
in summer-eat outside on a terrace (another great feature of suan)!!!,"[([5], [], 1)]"
i cannot imagine a friendlier staff working in a restaurant.,"[([5], [], 1)]"
i cannot imagine better indian food in all of the city.,"[([4, 5], [], 1)]"
"during the course of the past 3 months, the chef and staff changed and it was not for the better.","[([9], [], -1), ([11], [], -1)]"
the food now is inconsistent.,"[([1], [], -1)]"
this is the kind of place you'd like to take all your friends to and still keep a secret.,"[([5], [], 1)]"
the setting is casual and romantic.,"[([1], [], 1)]"
the food is excellent!,"[([1], [], 1)]"
"if you're daring, try the balsamic vinegar over icecream it's wonderful!","[([5, 6, 7, 8], [], 1)]"
do not get the go go hamburgers no matter what the reviews say.,"[([4, 5, 6], [], -1)]"
"the rest of the dim sum though pricey by chinatown standards, is worth it.","[([4, 5], [], -1), ([4, 5], [], 1)]"
"the wait here is long for dim sum, but if you don't like sharing tables or if the typical raucous dim sum atmosphere is not your gig, this is a sleek (for chinatown) alternative.","[([1], [], -1), ([22], [], -1)]"
a few tips: skip the turnip cake r roast pork buns nd egg custards,"[([5, 6], [], -1), ([8, 9, 10], [], -1), ([12, 13], [], -1)]"
the food was exceptional.,"[([1], [], 1)]"
"i choose to go with one of the special, the braised lamb shank in red wine which was excellent.","[([10, 11, 12, 13, 14, 15], [], 1)]"
the service was friendly and the atmosphere was casual.,"[([1], [], 1), ([6], [], 0)]"
the restaurant is a bit noisy but that is something that can be overlooked once you sit down and enjoy a great meal,"[([22], [], 1), ([1], [], -1)]"
this little place has a cute interior decor and affordable city prices.,"[([6, 7], [], 1), ([2], [], 1)]"
"the pad se ew chicken was delicious, however the pad thai was far too oily.","[([1, 2, 3, 4], [], 1), ([9, 10], [], -1)]"
"have eaten at ginger house several times, and it's always good.","[([3, 4], [], 1)]"
the fried dumplings are great!,"[([1, 2], [], 1)]"
finally a reliable chinese restaurant,"[([3, 4], [], 1)]"
this place would be so much better served by being run by a group that actually understands customer service,"[([17, 18], [], -1)]"
"terrible, terrible management - deserves to be shut-down.","[([2], [], -1)]"
delicious bagels especially when right out of the oven.,"[([1], [], 1)]"
spreads and toppings are great - though a bit pricey.,"[([0], [], 1), ([2], [], 1), ([0], [], -1), ([2], [], -1)]"
service is fast and friendly.,"[([0], [], 1)]"
"the food is decent at best, and the ambience well, it's a matter of opinion, some may consider it to be a sweet thing, i thought it was just annoying.","[([1], [], -1), ([8], [], -1)]"
"rao is a good restaurant, but it's nothing special.","[([0], [], 0)]"
"but after last night, spice grill is the only place i'm eating indian cuisine","[([12, 13], [], 1)]"
you must try the shrimp appetizers,"[([4, 5], [], 1)]"
this place has the the correct ambience and an excellent staff to make you feel like a guest and a friend at the same time.,"[([6], [], 1), ([10], [], 1)]"
"great food great prices, great s service","[([1], [], 1), ([6], [], 1)]"
"if you are looking for a good quality, cheap eats - this is the place.","[([9], [], 1), ([9], [], 1)]"
it's a perfect place to have a amanzing indian food,"[([8, 9], [], 1)]"
i really loved the different and inovated touch that's the cheff gives to the food.,"[([10], [], 1)]"
also it's great to have dinner in a very romantic and confortable place the s service t's just perfect...they're so frendly that we never want to live the place!,"[([12], [], 1), ([15], [], 1)]"
"their bagels are fine, but they are a little overcooked, and not really a 'special' bagel experience.","[([1], [], -1)]"
great bagels made the old-fashioned way.,"[([1], [], 1), ([1], [], 1)]"
drawbacks: service is slow and they don't toast!,"[([1], [], -1)]"
the food was absolutely amazing!!,"[([1], [], 1)]"
the baked clams octopus we shared as appetizers were the best we've ever had!!,"[([1, 2, 3], [], 1)]"
"the lamb was tender so full of flavor, the dessert was divine!!","[([1], [], 1), ([9], [], 1)]"
the waiter was attentive.,"[([1], [], 1)]"
the place itself is beautiful the bar scene seems to be happening.,"[([1], [], 1), ([6, 7], [], 1)]"
"downtown dinner 2002 - prixe fix: appetizers were ok, waiter gave me poor suggestion..try the potato stuff kanish best one.","[([6], [], 0), ([9], [], -1), ([15, 16, 17], [], 1)]"
small servings for main entree i had salmon (wasnt impressed) girlfriend had chicken it was good.,"[([7], [], -1), ([12], [], 1), ([1, 2, 3, 4], [], -1)]"
dessert is a joke...dont bother,"[([0], [], -1)]"
"volare virgins or weekly regulars, everyone gets treated the same and you can't ask for more than that when the service is this friendly.","[([20], [], 1)]"
"the restaurant has a family feel, not least with regard to the portions which are enormous; the veal alone could have single-handedly solved third world famine.","[([1], [], 1), ([12], [], 1), ([17], [], 1)]"
"the anti-pasta was excellent, especially the calamari as were the filling p pasta mains","[([1], [], 1), ([6], [], 1), ([12, 13], [], 1), ([12, 13], [], 1)]"
the wine list is extensive and can easily hike up an otherwise reasonably priced meal,"[([1, 2], [], 1), ([14], [], 1)]"
"still, any quibbles about the bill were off-set by the pour-your-own measures of liquers which were courtesey of the house...","[([11, 12, 13], [], 1)]"
fantastic place,"[([1], [], 1)]"
lucky strike is a great casual place to just grab a bite to eat.,"[([0, 1], [], 1)]"
great food great d decor great service,"[([1], [], 1), ([4], [], 1), ([6], [], 1)]"
"this is the perfect spot for meeting friends, having lunch, dinner, pre-theatre or after-theatre drinks!","[([4], [], 1)]"
(always ask the bartender for the seasonal beer !!,"[([6, 7], [], 1)]"
excellent spot for holiday get togethers with co-workers or friends that you haven't seen in a while.,"[([1], [], 1)]"
i have been doing all of the above at the heartland brewery for over 5 years now and i have never been disappointed!,"[([10, 11], [], 1)]"
what a great place,"[([3], [], 1)]"
not the typical nyc gimmick theme restaurant,"[([6], [], 1)]"
a cool bar with great food and tons of excellent b beer,"[([2], [], 1), ([5], [], 1), ([11], [], 1), ([11], [], 1)]"
the shrimp scampi was excellent and the antipasti were plentiful.,"[([1, 2], [], 1), ([7], [], 1)]"
"if you venture off the island of manhattan and can't seem to find a great italian restaurant, drive to corona","[([19], [], 1)]"
the only thing more wonderful than the food (which is exceptional) is the service,"[([7], [], 1), ([13], [], 1)]"
the only thing the waiters don't do for you is wipe your chin when you leave.,"[([4], [], 1)]"
cozy romantic atomosphere with only around 15 tables at most.,"[([2], [], 1)]"
service was very prompt but slightly rushed.,"[([0], [], 1)]"
"food was very good, but not what i would consider out of this world.","[([0], [], 0)]"
too bad the food wasn't of the same heritage.,"[([3], [], -1)]"
"the porcini mushroom pasta special was tasteless, so was the seafood tagliatelle","[([1, 2, 3, 4], [], -1), ([10, 11], [], -1)]"
but that wasn't the icing on the cake: a tiramisu that resembled nothing i have ever had.,"[([9], [], -1)]"
i really liked this place,"[([4], [], 1)]"
this place has the best chinese style bbq ribs in the city.,"[([7, 8], [], 1), ([7, 8], [], 1)]"
i also recommend the rice dishes or the different varieties of congee (rice porridge),"[([4, 5], [], 1), ([11, 12, 13], [], 1)]"
it's definately not a place to go if you want to impress someone.,"[([4], [], -1)]"
"however, if you want great food at a great price and don't mind the decor you can't beat this place.","[([5], [], 1), ([14], [], 0), ([5], [], 1)]"
quick and friendly service,"[([3], [], 1)]"
"when you're sitting in their main dining room (which has a spectacular, hand-painted high ceiling you'd never know there was a world outside.","[([5, 6, 7], [], 1), ([14], [], 1)]"
"the food is wonderful, tasty and filling, and the service is professional and friendly.","[([1], [], 1), ([1], [], 1), ([9], [], 1)]"
"i can't wait for summer, when they serve outside on their gigantic patio","[([12], [], 1)]"
i recently tried suan and i thought that it was great.,"[([3], [], 1)]"
this little place definitely exceeded my expectations and you sure get a lot of food for your money.,"[([14], [], 1), ([2], [], 1), ([14], [], 1)]"
the service was fast and friendly and the food was very tasty and they had the best hot sauce to add to your meals.,"[([1], [], 1), ([8], [], 1), ([17, 18], [], 1)]"
good food,"[([1], [], 1)]"
good drink,"[([1], [], 1)]"
i have never had cheescake like this.,"[([4], [], 1)]"
great spot whether looking for a couple of drinks or quiet dinner.,"[([1], [], 1), ([1], [], 1)]"
warm and friendly in the winter and terrific outdoor seating in the warmer months.,"[([8, 9], [], 1)]"
the food is great and they have a good selecion of wines at reasonable prices.,"[([1], [], 1), ([11], [], 1), ([11], [], 1)]"
"while the ambiance and atmosphere were great, the food and service could have been a lot better.","[([2], [], 1), ([4], [], 1), ([8], [], -1), ([10], [], -1)]"
"we ordered the chicken casserole but what we got were a few small pieces of chicken, all dark meat and on the bone.","[([3, 4], [], -1), ([3, 4], [], -1)]"
"i've been to sapphire twice and both times the food was fine, if not good.","[([9], [], 1)]"
stick with the chicken b beef and lamb dishes,"[([3], [], 1), ([5], [], 1), ([7, 8], [], 1)]"
"service is friendly, and never had a problem walking in and getting a table.","[([0], [], 1)]"
skip dessert,"[([1], [], -1)]"
best reuben sandwich ever!,"[([1, 2], [], 1)]"
don't miss bloom's on your next trip to manhatten.,"[([2], [], 1)]"
"it was the first place we ate on our first trip to new york, and it will be the last place we stop as we head out of town on our next trip to new york.","[([20], [], 1)]"
thanks bloom's for a lovely trip.,"[([1], [], 1)]"
"the food was not fresh, the sauces were bland and very oily.","[([1], [], -1), ([6], [], -1)]"
pizza was a little soggy.,"[([0], [], -1)]"
ravioli was good...but i have to say that i found everything a bit overpriced.,"[([0], [], 1)]"
not enough wines by the glass either.,"[([2, 3, 4, 5], [], -1)]"
"service however, was excellent...and i liked the setting/atmosphere a lot.","[([0], [], 1), ([7], [], 1)]"
"food was just average...if they lowered the prices just a bit, it would be a bigger draw.","[([0], [], 0)]"
this place is a great bargain.,"[([1], [], 1)]"
authentic pakistani food,"[([1, 2], [], 1)]"
people are always friendly.,"[([0], [], 1)]"
"just straight up cheap, good food","[([5], [], 1), ([5], [], 1)]"
faan is sooo good.,"[([0], [], 1)]"
the best pad thai i've ever had.,"[([2, 3], [], 1)]"
the design and atmosphere is just as good.,"[([1], [], 1), ([3], [], 1)]"
bottles of wine are cheap and good.,"[([0, 1, 2], [], 1), ([0, 1, 2], [], 1)]"
the food was actually aweful.,"[([1], [], -1)]"
"the mussles were the fishiest things i've ever tasted, the seabass was bland, the goat cheese salad was missing the goat cheese, the penne w/ chicken had bones in it... it was disgusting.","[([1], [], -1), ([10], [], -1), ([14, 15, 16], [], -1), ([23, 24, 25], [], -1)]"
nice atmosphere the s service as very pleasant and the desert was good.,"[([1], [], 1), ([4], [], 1), ([10], [], 1)]"
the jukebox plays everything from italian opera to the strokes.,"[([1], [], 1)]"
"the food is amazing, rich pastas and fresh doughy pizza","[([1], [], 1), ([5], [], 1), ([9], [], 1)]"
best of all is the warm vibe the o owner s super friendly and service is fast.,"[([6], [], 1), ([9], [], 1), ([14], [], 1)]"
go here for the drinks,"[([4], [], 1)]"
the drinks are amazing and half off till 8pm.,"[([1], [], 1), ([1], [], 1)]"
ask for usha the nicest bartender in manhattan.,"[([2], [], 1)]"
my fav was the sassy lassi ..,"[([4, 5], [], 1)]"
this is an amazing place to try some roti rolls,"[([8, 9], [], 1)]"
i really recommend the very simple unda (egg) rolls,"[([6, 7, 8], [], 1)]"
delicate spices o onions eggs and a kick-ass roti,"[([1], [], 1), ([3], [], 1), ([4], [], 1), ([8], [], 1)]"
"toons has recently been redone, so it's now a very attractive space.","[([0], [], 1)]"
the food s as good as ever.,"[([1], [], 1)]"
in an area sadly lacking in decent thai food this is one of the best spots.,"[([7, 8], [], 1)]"
went here last night - nice decor good s service but the food was surprisingly excellent.,"[([6], [], 1), ([9], [], 1), ([12], [], 1)]"
"the portions are huge, so it might be good to order three things to split (rather than one appetizer and entree per person) for two people.","[([1], [], 0)]"
best drumsticks over rice and sour spicy soup in town!,"[([1, 2, 3], [], 1), ([5, 6, 7], [], 1)]"
beef noodle soup is good as well.,"[([0, 1, 2], [], 1)]"
the service is good and the resturant is clean.,"[([1], [], 1), ([6], [], 1)]"
best taiwanese food in ny!,"[([1, 2], [], 1)]"
i have been to rao's probably 15 times the past 3 years and it keeps getting better.,"[([4], [], 1)]"
rao's has the best service and atmosphere in nyc.,"[([4], [], 1), ([6], [], 1)]"
my roommate and i love this place,"[([6], [], 1)]"
"we recently decided to try this location, and to our delight, they have outdoor seating perfect since i had my yorkie with me.","[([13, 14], [], 1)]"
indoor was very cozy and cute.,"[([0], [], 1)]"
"the portion sizes here are huge, and the sushi is good.","[([1, 2], [], 1), ([8], [], 1)]"
staff is very accomodating.,"[([0], [], 1)]"
"excellent dumplings served amid clean, chic decor","[([1], [], 1), ([6], [], 1)]"
i got the $10 10-piece dim sum combo every bite of which was great.,"[([3, 4, 5, 6, 7], [], 1)]"
the decor is very simple but comfortable.,"[([1], [], 1)]"
the food was delicious but do not come here on a empty stomach.,"[([1], [], 1), ([1], [], -1)]"
the portions are small but being that the food was so good makes up for that.,"[([1], [], -1), ([8], [], 1)]"
you must have the crabmeat lasagna which is out of this world and the chocolate bread pudding for dessert.,"[([4, 5], [], 1), ([14, 15, 16], [], 1)]"
the staff there is very attentive and down to earth.,"[([1], [], 1)]"
great indian food and the service is incredible.,"[([1, 2], [], 1), ([5], [], 1)]"
the owner truly caters to all your needs.,"[([1], [], 1)]"
great food and the prices are very reasonable.,"[([1], [], 1)]"
the food here does a great service to the name (cantonese that is...).,"[([1], [], 1)]"
i fell in love with the egg noodles in the beef broth with shrimp dumplings and slices of bbq roast pork,"[([6, 7, 8, 9, 10, 11, 12, 13, 14, 15, 16, 17, 18, 19, 20], [], 1)]"
this dish is my favorite and i always get it when i go there and never get tired of it.,"[([1], [], 1)]"
try the congee and the donut like deep fried dough they call ow ley soh a delicious and sweet tasting bread.,"[([2], [], 1), ([12, 13, 14], [], 1)]"
simply some good tasting chinese food at incredible prices...,"[([4, 5], [], 1), ([4, 5], [], 1)]"
service is not what you are coming here for...,"[([0], [], -1)]"
big wong is a great place to eat and fill your stomach.,"[([0, 1], [], 1)]"
"whoever the jazz duo was, they were on point.","[([2, 3], [], 1)]"
good music great f food speedy service affordable prices.,"[([1], [], 1), ([4], [], 1), ([6], [], 1)]"
even the wine by the glass was good.,"[([2, 3, 4, 5], [], 1)]"
consistently good japanese tapas,"[([2, 3], [], 1)]"
always good drinks and service is pretty good;,"[([2], [], 1), ([4], [], 1)]"
atmosphere is nice and relaxed too...,"[([0], [], 1)]"
a great place to meet up for some food and drinks...,"[([2], [], 1)]"
yakitori (bbq meats) is tasty too.,"[([0, 1, 2], [], 1)]"
if you don't mind pre-sliced low quality fish unfriendly s staff nd a sushi chef that looks like he is miserable then this is your place.,"[([7], [], -1), ([10], [], -1), ([13, 14], [], -1)]"
price and quality of fish alone will keep us from making a return visit.,"[([4], [], -1), ([4], [], -1)]"
