sentences,aos
the pizza and wine were excellent-the service too--but what really made this place was the backyard dining area,"[([1], [], 1), ([3], [], 1), ([6], [], 1), ([15, 16, 17], [], 1)]"
it is one the nicest outdoor restaurants i have ever seen in ny--i am from italy and this place rivals the ones in my country.,"[([5, 6], [], 1)]"
check this place out!,"[([2], [], 1)]"
"first of all, this place is *not* romantic, as claimed by citysearch's editorial review.","[([4], [], -1)]"
"the tables are crammed way too close, the menu is typical of any italian restaurant, and the wine list is simply overpriced.","[([1], [], -1), ([8], [], 0), ([17, 18], [], -1)]"
slightly above average wines start at $70+ with only one selection listed at $30+.,"[([3], [], -1), ([3], [], -1)]"
service is not what one would expect from a joint in this price category.,"[([0], [], -1)]"
somehow working the italian charm with constant mille grazie does not constitute proper service,"[([13], [], -1)]"
"to be completely fair, the only redeeming factor was the food which was above average, but couldn't make up for all the other deficiencies of t teodora","[([10], [], 1), ([26], [], -1)]"
not one of our meals was edible - bland and/or made with weird rosemary or orange flavoring,"[([4], [], -1), ([13, 14, 15, 16], [], -1)]"
fish was overdone.,"[([0], [], -1)]"
cute place nice wait staff but would never go there again.,"[([3, 4], [], 1), ([1], [], 1), ([1], [], -1)]"
someone else recommended the dessert - we also left that.,"[([4], [], -1)]"
one of us actually liked the expresso - that's it.,"[([6], [], 1)]"
skip this restaurant it's a big disappointment.,"[([2], [], -1)]"
myagi is one of my favorite restaurants in the city; the place the negative reviews describe sound like they were somewhere else.,"[([0], [], 1)]"
i've never had bad service and the fish is fresh and delicious.,"[([4], [], 1), ([7], [], 1)]"
their tuna tartar appetizer is to die for.,"[([1, 2, 3], [], 1)]"
"i come from a family of pizzeria owners, and i'm almost ashamed to say that the pizza in fornino's blows my families receipies away.","[([16], [], 1)]"
the place is so cool and the service is prompt and curtious.,"[([7], [], 1), ([1], [], 1)]"
i highly recommend to anyone to give this place a try.,"[([8], [], 1)]"
a restaurant that doesn't try to do anything except serve great food with great service in a pleasant atmosphere,"[([11], [], 1), ([14], [], 1), ([18], [], 1)]"
no gimmicks here -- the food speaks for itself in its freshness and preparation.,"[([5], [], 1)]"
the dining room is quietly elegant with no music to shout over -- how refreshing!,"[([1, 2], [], 1)]"
"the service was impeccable and unobtrusive -- the staff knows what they are there to do -- to know their menu, present your meal, and attend to your needs.","[([1], [], 1), ([8], [], 1)]"
"looking around, i saw a room full of new yorkers enjoying a real meal in a real restaurant not a clubhouse of the fabulous trying to be seen.","[([13], [], 1), ([17], [], 1)]"
the view is breathtaking the service is top notch... the ambiance is wonderfull.,"[([1], [], 1), ([5], [], 1), ([10], [], 1)]"
the staff offers impeccable service.,"[([1], [], 1)]"
i had lobster bisque it has 2 oz. of maine lobster in it.,"[([2, 3], [], 1)]"
my boyfriend had the new england chowder it was good but i think the award should go to the lobster bisque,"[([4, 5, 6], [], 1), ([19, 20], [], 1)]"
my boyfriend had prime rib it was good .,"[([3, 4], [], 1)]"
we didn't want a bottle of bubbly on a weekday so we each got little bottles of korbett it was just enough.,"[([15, 16, 17], [], 1)]"
my wife and i ate here earlier this week and have not stopped ranting and raving about the food,"[([18], [], 1)]"
if you like spicy food get the chicken vindaloo,"[([7, 8], [], 1)]"
go to volare for 1st class service and terrific food,"[([6], [], 1), ([9], [], 1)]"
the portions are large and the servers always surprise us with a different starter.,"[([1], [], 1)]"
the wine list is excellent.,"[([1, 2], [], 1)]"
the food is amazing... especially if you get the chef's tasting menu and your favourite bottle (or two!) of wine from an extensive selection of wines,"[([1], [], 1), ([23, 24, 25], [], 1), ([9, 10, 11], [], 1)]"
"the place is small and intimate and you may feel a little crowded, but the service is excellent and it's great for friends out, a romantic date, or a special occassion.","[([15], [], 1), ([1], [], -1), ([1], [], 1)]"
the food can get pricey but the prixe fixe tasting menu is the greatest food for a good price and they cater the food to any food allergies or food you don't like.,"[([1], [], -1), ([7, 8, 9, 10], [], 1), ([7, 8, 9, 10], [], 1)]"
"with the exception of our lemon salad that had so much pepper on it that our eyes started watering, the food here was decent, not great.","[([20], [], 0), ([5, 6], [], -1)]"
the menu is very limited - i think we counted 4 or 5 entrees.,"[([1], [], -1)]"
"we ordered the special, grilled branzino that was so infused with bone, it was difficult to eat.","[([4, 5], [], -1)]"
"the decor in this place is very diner-ish and the kind of place you expect in the east village - not romantic, just simple, small and sparse.","[([1], [], 0)]"
problem is nothing at prune is particularly memorable.,"[([4], [], -1)]"
this place is so much fun.,"[([1], [], 1)]"
our family never expected such incredible entertainment in a restaurant.,"[([6], [], 1)]"
our food was great too!,"[([1], [], 1)]"
and really large portions,"[([3], [], 1)]"
the staff was the friendliest that have seen in new york.,"[([1], [], 1)]"
if you want something really different than try jekyll and hyde,"[([8, 9, 10], [], 1)]"
the food was pretty tradional but it was hot and good with large portions,"[([1], [], 1), ([13], [], 1)]"
the place is a lot of fun.,"[([1], [], 1)]"
the characters really make for an enjoyable experience.,"[([1], [], 1)]"
"the food however, is what one might expect.","[([1], [], -1)]"
"however, i think jeckll and hydes t is one of those places that is fun to do once.","[([3, 4, 5], [], 1)]"
service was slow had to wait to order and get food although not crowded.,"[([0], [], -1)]"
drinks way over priced.,"[([0], [], -1)]"
food was good not great not worth the wait or another visit,"[([0], [], 0)]"
great pizza for lunch place.,"[([1], [], 1)]"
service was quick.,"[([0], [], 1)]"
the pizza was great.,"[([1], [], 1)]"
"whenever you need a sushi fix, mizu will be there with quality fish and great service","[([12], [], 1), ([15], [], 1)]"
delivery is fast too.,"[([0], [], 1)]"
great friendly service fast s seating fast delivery excellent s sushi,"[([2], [], 1), ([5], [], 1), ([7], [], 1), ([10], [], 1)]"
ess-a-bagel (either by sty-town or midtown) is by far the best bagel in ny.,"[([11], [], 1)]"
"the bagels always warm, soft on the inside, crispy on the outside and enormous in size.","[([1], [], 1), ([1], [], 1)]"
they have a huge selection of different cream cheeses and all of their salads are great.,"[([13], [], 1), ([7, 8], [], 1)]"
the lox is always fresh too.,"[([1], [], 1)]"
not impressed with the food,"[([4], [], -1)]"
prices too high for this cramped and unappealing resturant,"[([8], [], -1), ([8], [], -1)]"
zero ambiance to boot.,"[([1], [], -1)]"
i thought this place was totally overrated.,"[([3], [], -1)]"
"the ambience was nice, but service wasn't so great.","[([1], [], 1), ([5], [], -1)]"
this is the best shabu-shabu restaurant in the try-state area.,"[([4, 5], [], 1)]"
i have lived in japan for 7 years and the taste of the food and the feel of the restaurant is like being back in japan.,"[([13], [], 1), ([16], [], 1)]"
thius is a must for anyone who loves shabu-shabu,"[([8], [], 1)]"
"the atmosphere is nothing special, but it feels like a sushi establishment in tokyo.","[([1], [], 1)]"
the owner and staff are all japanese as well and that adds to the entire ambiance,"[([1], [], 1), ([3], [], 1), ([15], [], 1)]"
"despite a slightly limited menu everything prepared is done to perfection, ultra fresh and a work of food art.","[([4], [], -1)]"
taxan delicious!,"[([0], [], 1)]"
the prices were cheap compared to the quality of service and food,"[([9], [], 1), ([11], [], 1)]"
the location and ambience is ok but the food is what makes up for it.,"[([1], [], 0), ([3], [], 0), ([8], [], 1)]"
try green curry with vegetables,"[([1, 2, 3, 4], [], 1)]"
"the quantity is also very good, you will come out satisfied.","[([1], [], 1)]"
"the service is ok, some of the people didn't get what they asked for.","[([1], [], 0)]"
i had the best ravioli ever.,"[([4], [], 1)]"
the wine the service was very good too.,"[([1], [], 1), ([3], [], 1)]"
this quaint and romantic trattoria is at the top of my manhattan restaurant list.,"[([4], [], 1), ([4], [], 1)]"
the food is delicious - from the specials to the regular menu-fare the dishes are never a disappointment.,"[([1], [], 1), ([13], [], 1), ([7], [], 1), ([10, 11], [], 1)]"
whether it's the parmesean porcini souffle or the lamb glazed with balsamic vinegar you will surely be transported to northern italy with one bite.,"[([3, 4, 5], [], 1), ([8, 9, 10, 11, 12], [], 1)]"
"although the tables may be closely situated, the candle-light f food uality and service overcompensate.","[([8], [], 1), ([10], [], 1), ([13], [], 1), ([2], [], -1)]"
"i have known about this secret for the last 13 years, emilio(the godfather) has continued to serve food and wine for the gods at mortal prices.","[([17], [], 1), ([19], [], 1), ([17], [], 1), ([19], [], 1)]"
"if you go, try the marinara/arrabiatta sauce the m mozzarella en carozza s mmmmmmmm..... everything is just delicious.","[([5, 6], [], 1), ([9, 10, 11], [], 1)]"
check out the secret back room,"[([4, 5], [], 1)]"
thank you emilio,"[([2], [], 1)]"
i found the food s service nd value exceptional everytime i have been there.,"[([3], [], 1), ([5], [], 1)]"
the food was authentic.,"[([1], [], 1)]"
the service was excellent - friendly and attentive.,"[([1], [], 1)]"
very good wine choices,"[([2, 3], [], 1)]"
who has room for cheesesticks with the best pizza in nyc!,"[([8], [], 1)]"
get the pepperoni - yum - and a family style salad,"[([2], [], 1), ([8, 9, 10], [], 1)]"
great staff,"[([1], [], 1)]"
always great service,"[([2], [], 1)]"
"the food is good, i can't lie.","[([1], [], 1)]"
but the staff was so horrible to us.,"[([2], [], -1)]"
the hostess and the waitress were incredibly rude and did everything they could to rush us out.,"[([1], [], -1), ([4], [], -1)]"
we were planning to get dessert but the waitress basically through the bill at us before we had a chance to order.,"[([8], [], -1)]"
"this place is pricey, and yes, the food is worth it; but the service makes you feel like you should be paying a quater of the price.","[([1], [], -1), ([7], [], 1), ([13], [], -1)]"
amma is nothing special.,"[([0], [], 0)]"
i ate here a week ago and found most dishes average at best and too expensive.,"[([9], [], -1), ([9], [], -1)]"
don't dine at tamarind for the vegetarian dishes they are simply not up to par with the n non-veg selections,"[([6, 7], [], -1), ([18, 19], [], 1)]"
decor is nice though service can be spotty.,"[([0], [], 1), ([4], [], -1)]"
this place is always packed.,"[([1], [], 0)]"
"most importantly, food is excellent.","[([2], [], 1)]"
try the sea bass,"[([2, 3], [], 1)]"
first of all dal bukhara rocks.,"[([3, 4], [], 1)]"
i am happy i did the food was awsome.,"[([6], [], 1)]"
and yes dal bukhara is so dam good and so are all the kababs,"[([13], [], 1), ([2, 3], [], 1)]"
haru on park s is simply disgusting.,"[([0, 1, 2, 3], [], -1)]"
the fish was not fresh and the rice tasted old and stale.,"[([1], [], -1), ([7], [], -1)]"
"quite frankly, this is some of the worst sushi i have ever tried.","[([8], [], -1)]"
honestly the worst sushi my husband and i had in our entire lives.,"[([3], [], -1)]"
not sure why this restaurant would be rated that highly.,"[([4], [], -1)]"
the all-u-can-eat sushi is definitely in very poor quality.,"[([1, 2], [], -1)]"
limited menu no-so-fresh i ingredients thinly-sliced fish fall-apart r rice,"[([1], [], -1), ([4], [], -1), ([6], [], -1), ([9], [], -1)]"
"the only things u could really taste are the very salty soy sauce (even its low sodium), the vinegar-soaked rice and the scallion on top of the fish.","[([11, 12], [], -1), ([19], [], -1)]"
the waitstaffs are nice though.,"[([1], [], 1)]"
i have been to roth's twice and both times were very disappointing.,"[([4], [], -1)]"
both times i was extremely dissappointed by the service which was boarderline rude.,"[([8], [], -1)]"
"the dinner was ok, nothing i would have again.","[([1], [], -1)]"
"i had their eggs benedict for brunch, which were the worst in my entire life, i tried removing the hollondaise sauce completely that was how failed it was.","[([3, 4], [], -1)]"
with the theater 2 blocks away we had a delicious meal in a beautiful room,"[([10], [], 1), ([14], [], 1)]"
the service was attentive.,"[([1], [], 1)]"
planet thai is great!,"[([0, 1], [], 1)]"
we love the food d drinks and atmosphere,"[([3], [], 1), ([5], [], 1), ([7], [], 1)]"
"the svc can be a bit rude at times, esp if you have big group, but overall the restaurant is a must!","[([1], [], -1), ([18], [], 1)]"
try the pad thai it's fabulous and their prices are so cheap!,"[([2, 3], [], 1)]"
"just because it's cheap does not mean the portions are small or the food is nasty, it is great!","[([8], [], 1), ([13], [], 1)]"
"also, the sandwiches (nearing $7) didn't come with anything like chips or a side.","[([2], [], -1), ([2], [], -1)]"
"eating in, the atmosphere saves it, but at your desk, it's a very disappointing experience.","[([3], [], 1)]"
chennai garden is my favorite indian restaurant in the city.,"[([0, 1], [], 1)]"
they have authentic indian at amazin prices.,"[([3], [], 1), ([3], [], 1)]"
this restaurant is vegetarian; there are no meat dishes whatsoever.,"[([7, 8], [], -1)]"
the seats are uncomfortable if you are sitting against the wall on wooden benches.,"[([1], [], -1)]"
it's a rather cramped and busy restaurant and it closes early.,"[([6], [], -1), ([6], [], -1)]"
patroon features a nice cigar bar and has great staff,"[([4, 5], [], 1), ([9], [], 1)]"
the food is tasty and portion sizes are appropriate.,"[([1], [], 1), ([5, 6], [], 1)]"
this is a nice restaurant if you are looking for a good place to host an intimate dinner meeting with business associates.,"[([4], [], 1)]"
not a great place for family or general dining.,"[([3], [], -1)]"
lloovve this place,"[([2], [], 1)]"
food is excellent.,"[([0], [], 1)]"
fish is so very fresh.,"[([0], [], 1)]"
waitstaff are very friendly.,"[([0], [], 1)]"
love yuka,"[([1], [], 1)]"
mermaid inn is an overall good restaurant with really good seafood,"[([10], [], 1), ([0, 1], [], 1)]"
the menu is limited but almost all of the dishes are excellent.,"[([1], [], -1), ([9], [], 1)]"
the lobster sandwich is good and the spaghetti with scallops and shrimp is great.,"[([1, 2], [], 1), ([7, 8, 9, 10, 11], [], 1)]"
the service is good and ambience is good for a date or group outing.,"[([1], [], 1), ([5], [], 1)]"
the only fallback on this restaurant is the prices.,"[([5], [], -1)]"
even though its good seafood the prices are too high.,"[([4], [], 1)]"
the lobster sandwich is $24 and although it was good it was not nearly enough to warrant that price.,"[([1, 2], [], 1), ([1, 2], [], -1)]"
the food was delicious (i had a halibut special my husband had s steak and the s service as top-notch.,"[([1], [], 1), ([7, 8], [], 1), ([13], [], 1), ([17], [], 1)]"
"when my dessert came, there was a candle in it - not because anyone asked for one - but because the waiter must have seen me opening my birthday card and gift, and said he knew it was a special occassion of some sort.","[([21], [], 1)]"
truly the mark of an attentive waiter,"[([6], [], 1)]"
i highly recommend the restaurant based on our experience last night.,"[([4], [], 1)]"
we ate at this thai place following the reviews but very unhappy with the foods,"[([14], [], -1)]"
we thought that this place is using too much of msg cooking in the foods,"[([14], [], -1)]"
i recommend the jelly fish d drunken chicken nd the soupy dumplings certainly the s stir fry blue crab,"[([3, 4], [], 1), ([6, 7], [], 1), ([10, 11], [], 1), ([15, 16, 17, 18], [], 1)]"
the food is so cheap and the waiters are nice.,"[([1], [], 1), ([7], [], 1)]"
have frequented 'ino for several years and the food remains excellent.,"[([8], [], 1)]"
cheese plate is a varied delight and great bargain at $10.,"[([0, 1], [], 1), ([0, 1], [], 1), ([0, 1], [], 1)]"
the large selection of bruschettas p paninis tramezzinis keep the palate from stagnating.,"[([4], [], 1), ([6], [], 1), ([7], [], 1)]"
"(the asparagus, truffle oil, parmesan bruschetta is a winner!)","[([1, 2, 3, 4, 5], [], 1)]"
wine list is extensive without being over-priced.,"[([0, 1], [], 1), ([0, 1], [], 1)]"
"be sure to try the seasonal, and always delicious, specials","[([9], [], 1)]"
i loved this place !,"[([3], [], 1)]"
i almost hesititate to write a review because the atmosphere was so great and i would hate for it too become to crowded.,"[([9], [], 1)]"
"the food was very good, a great deal, and the place its self was great.","[([1], [], 1), ([1], [], 1), ([10], [], 1)]"
"the wait staff is very freindly, they make it feel like you're eating in a freindly little european town.","[([1, 2], [], 1)]"
"i like cafe noir dont get me wrong, it is jsut that the people who work there are evil and incompetent!!","[([13], [], -1), ([2, 3], [], 1)]"
"the service was terrible, we had to wait for everything and ask several of different people for the same thing before we were allowed to be served.","[([1], [], -1)]"
the waitress seems to be more concerned of looking good than actually waitressing.,"[([1], [], -1)]"
"after dinner the manager grabbed my boyfriend, asked him: where are you from...maybe you dont know how things work in america...and in the end stormed away almost teareyed yelling that tips are the only thing they survive on.","[([3], [], -1)]"
"we did tip, i guess the model/ waitress just wanted more and complained to the manager.","[([7], [], -1)]"
the whole set up is truly unprofessional and i wish cafe noir would get some good staff because despite the current one this is a great place.,"[([16], [], -1), ([10, 11], [], 1)]"
pizza here is consistently good.,"[([0], [], 1)]"
salads are a delicious way to begin the meal.,"[([0], [], 1)]"
you should pass on the calamari,"[([5], [], -1)]"
decor is charming.,"[([0], [], 1)]"
service is average.,"[([0], [], 0)]"
what a great place,"[([3], [], 1)]"
"the ambience was so fun, and the prices were great, on top of the fact that the food was really tasty.","[([1], [], 1), ([17], [], 1)]"
i would definitely recommend sea if you like thai cuisine,"[([8, 9], [], 1)]"
i was here a few weeks back and we had the worst customer service experience at a restaurant ever.,"[([12, 13], [], -1)]"
"a gentleman maybe the manager, came to our table, and without so much as a smile or greeting asked for our order.","[([1], [], -1)]"
i absolutely loved this place,"[([4], [], 1)]"
excellent atmosphere delicious d dishes ood and friendly service,"[([1], [], 1), ([4], [], 1), ([8], [], 1)]"
the wine list is also really nice.,"[([1, 2], [], 1)]"
everything was wonderful; food d drinks staff m mileau,"[([3], [], 1), ([5], [], 1), ([6], [], 1), ([8], [], 1)]"
i would highly recommend this place,"[([5], [], 1)]"
i have been to casimir over 5 times and i have always had a great time there.,"[([4], [], 1)]"
the food is great and reasonably priced.,"[([1], [], 1), ([1], [], 1)]"
"i have tried to make reservations, but both times, the hostess didn't have my name.","[([10], [], -1)]"
"if the weather is nice, try to snag an outside table","[([9, 10], [], 1)]"
"the staff has been nice, but they seemed really stressed and the unisex bathroom needs to be cleaned more often.","[([1], [], 1), ([12, 13], [], -1)]"
from the spectacular caviar to the hospitable waitstaff i felt like royalty and enjoyed every second of it.,"[([3], [], 1), ([7], [], 1)]"
"considering we were the last patrons there and it was after the closing time, the waitstaff did not rush us at all and made us feel comfortable and relaxed.","[([15], [], 1)]"
i highly recommend caviar russe to anyone who wants delicious top grade caviar and fantastic service,"[([12], [], 1), ([15], [], 1)]"
nice family owned traditional restaurant,"[([4], [], 1)]"
fresh ingredients and everything is made to order.,"[([1], [], 1)]"
friendly staff that actually lets you enjoy your meal and the company you're with.,"[([1], [], 1)]"
"i found the food to be outstanding, particulary the salmon dish i had.","[([3], [], 1), ([9, 10], [], 1)]"
i also ordered the change mojito which was out of this world.,"[([4, 5], [], 1)]"
"my friends settled for rice dishes, but we came back the following day to try the dim sum which was good...not outstanding, but good.","[([16, 17], [], 0)]"
we ate out in the back patio which is worth it as it's cool and the m music s hear well there.,"[([5, 6], [], 1), ([17], [], 1)]"
"overall, excellent restaurant","[([2], [], 1)]"
the food was good.,"[([1], [], 1)]"
the place was nice and calm.,"[([1], [], 1)]"
but the service was a bit slow.,"[([2], [], -1)]"
the buffet had a nice selection.,"[([1], [], 1)]"
the food was average or above including some surprising tasty dishes,"[([1], [], 1), ([10], [], 1)]"
service was also very good.,"[([0], [], 1)]"
i got an excellent piece of cheesecake and we had several other nice pastries,"[([6], [], 1), ([13], [], 1)]"
"i would recommend roxy's for that, but not for their food","[([10], [], -1)]"
my son and his girlfriend both wanted cheeseburgers and they were huge!,"[([7], [], 0)]"
"consequently, their burgers fell apart in their hands and made such a mess that they did'nt feel like finishing them.","[([2], [], -1)]"
i had a huge pastrami sandwich on a roll,"[([4, 5, 6, 7, 8], [], 0)]"
"this place is really trendi but they have forgotten about the most important part of a restaurant, the f food","[([19], [], -1), ([1], [], 1)]"
"the last two times i ordered from here my food was soo spicy that i could barely eat it, and the s spice ook away from the flavor of the dish.","[([9], [], -1), ([22], [], -1)]"
and the tom kha soup was pathetic.,"[([2, 3, 4], [], -1)]"
if you want good authentic thai this place is not the place to go.,"[([5], [], -1)]"
"we went here for lunch a couple of weeks ago on a saturday, and i was thoroughly impressed with the food","[([20], [], 1)]"
"the pesto pizza was excellent, thin-crust pizza with a nice amount of spicy italian cheese that i'd never heard of before.","[([1, 2], [], 1), ([12, 13, 14], [], 1)]"
"the back garden sitting area is very pleasant, where you can see their personal herb garden.","[([1, 2, 3, 4], [], 1)]"
we had the lobster sandwich and it was fantastic.,"[([3, 4], [], 1)]"
"my husband said he could've eaten several more, the portion was fine for me he even exclaimed that the french fries were the best he has had.","[([9], [], 1), ([19, 20], [], 1)]"
we had the scallops as an appetizer and they were delicious and the sauce was wonderful.,"[([3], [], 1), ([13], [], 1)]"
we waited at the bar and had martinis that were just right.,"[([7], [], 1)]"
love the food,"[([2], [], 1)]"
it's the only place you can get yummy authentic japanese comfort food,"[([9, 10, 11], [], 1)]"
i've lived in ny for 5 years and this place has it all.,"[([9], [], 1)]"
great food good size m menu great service and an unpretensious setting,"[([1], [], 1), ([5], [], 1), ([7], [], 1), ([11], [], 1)]"
"the dishes offered were unique, very tasty and fresh from the lamb sausages s sardines with biscuits large whole shrimp to the amazing pistachio ice cream (the best and freshest i've ever had).","[([1], [], 1), ([11, 12], [], 1), ([14, 15, 16], [], 1), ([17, 18, 19], [], 1), ([23, 24, 25], [], 1)]"
i'm glad i was introduced to this place and this is a rare gem in ny.,"[([7], [], 1)]"
"the freshest, best variety, and the fastest delivery","[([7], [], 1)]"
the service was excellent and the food was delicious.,"[([1], [], 1), ([6], [], 1)]"
we are very particular about sushi and were both please with every choice which included: ceviche mix (special) c crab dumplings assorted sashimi s sushi nd rolls t two types of sake and the banana tempura,"[([5], [], 1), ([15, 16, 17], [], 1), ([19, 20], [], 1), ([21, 22], [], 1), ([24], [], 1), ([26], [], 1), ([28, 29, 30, 31], [], 1), ([34, 35], [], 1)]"
definitely a great spot for a nice occasion or date.,"[([3], [], 1)]"
average to good thai food but terrible d delivery,"[([3, 4], [], 1), ([8], [], -1)]"
a thai restaurant out of rice during dinner?,"[([1, 2], [], -1)]"
"the food arrived 20 minutes after i called, cold and soggy.","[([1], [], -1)]"
this is a wonderful place on all stand points especially value ofr money.,"[([4], [], 1), ([4], [], 1)]"
an excellent service,"[([2], [], 1)]"
we were greeted promptly by the waiter who was very nice and cordial.,"[([6], [], 1)]"
she was very helpful in suggesting us drinks and helped us in ordering a lot of good dishes since we knew nothing about indian food.,"[([17], [], 1)]"
the food looked very appetizing and delicious since it came on a variety of fancy plates.,"[([1], [], 1)]"
we ended our great experience by having gulab jamun (dessert) recommended by the waiter.,"[([7, 8, 9], [], 1)]"
i thanked my friend who recommended me this restaurant and will certainly recommend it to others.,"[([8], [], 1)]"
"service here was great, food was fantastic.","[([0], [], 1), ([4], [], 1)]"
"guacamole+shrimp appetizer was really great, we both had the filet , very good, didn't much like th frites s that came with, but the filet was so good, neither of us cared.","[([0, 1], [], 1), ([9], [], 1), ([17], [], -1)]"
you cannot go wrong with this place,"[([6], [], 1)]"
