sentences,aos
judging from previous posts this used to be a good place but not any longer.,"[([10], [], -1)]"
"we, there were four of us, arrived at noon - the place was empty - and the staff acted like we were imposing on them and they were very rude.","[([17], [], -1)]"
the food was lousy - too sweet or too salty and the portions tiny.,"[([1], [], -1), ([12], [], -1)]"
avoid this place,"[([2], [], -1)]"
"i have eaten at saul, many times, the food is always consistently, outrageously good.","[([8], [], 1)]"
saul is the best restaurant on smith street and in brooklyn.,"[([0], [], 1)]"
the duck confit is always amazing and the foie gras terrine with figs was out of this world.,"[([8, 9, 10, 11, 12], [], 1), ([1, 2], [], 1)]"
the wine list is interesting and has many good values.,"[([1, 2], [], 1), ([1, 2], [], 1)]"
i was very disappointed with this restaurant,"[([6], [], -1)]"
ive asked a cart attendant for a lotus leaf wrapped rice and she replied back rice and just walked away.,"[([3, 4], [], -1)]"
"food was okay, nothing great.","[([0], [], 0)]"
chow fun was dry; pork shu mai was more than usually greasy and had to share a table with loud and rude family.,"[([0, 1], [], -1), ([4, 5, 6], [], -1)]"
i/we will never go back to this place again.,"[([7], [], -1)]"
"went on a 3 day oyster binge, with fish bringing up the closing, and i am so glad this was the place it o trip ended, because it was so great!","[([8], [], 1)]"
"service was devine, oysters where a sensual as they come, and the price can't be beat!!!","[([0], [], 1), ([3], [], 1)]"
every time in new york i make it a point to visit restaurant saul on smith street.,"[([12, 13], [], 1)]"
"everything is always cooked to perfection, the service is excellent, the decor cool and understated.","[([7], [], 1), ([11], [], 1)]"
i had the duck breast special on my last visit and it was incredible.,"[([3, 4, 5], [], 1)]"
"the food is very average...the thai fusion stuff is a bit too sweet, every thing they serve is too sweet here.","[([1], [], -1), ([5, 6, 7], [], -1)]"
the only thing i moderately enjoyed was their grilled chicken special with edamame puree,"[([8, 9, 10, 11, 12, 13], [], 1)]"
i had never had edamame pureed before but i thought it was innovative and tasty (could've used a bit more salt).,"[([4, 5], [], 1), ([4, 5], [], 1)]"
"the decor is night tho...but they really need to clean that vent in the ceiling...its quite un-appetizing, and kills your effort to make this place look sleek and modern.","[([24], [], -1), ([1], [], 1), ([11], [], -1)]"
"their sake list was extensive, but we were looking for purple haze, which wasn't listed but made for us upon request!","[([1, 2], [], 1)]"
"the spicy tuna roll was unusually good and the rock shrimp tempura was awesome, great appetizer to share!","[([1, 2, 3], [], 1), ([9, 10, 11], [], 1)]"
we went around 9:30 on a friday and it had died down a bit by then so the service was great!,"[([18], [], 1)]"
we love th pink pony,"[([3, 4], [], 1)]"
the perfect spot,"[([2], [], 1)]"
food awesome.,"[([0], [], 1)]"
service friendly and attentive.,"[([0], [], 1)]"
ambiance relaxed and stylish.,"[([0], [], 1)]"
"don't judge this place prima facie, you have to try it to believe it, a home away from home for the literate heart.","[([3], [], 1)]"
the food is decent.,"[([1], [], 0)]"
"however, it's the service that leaves a bad taste in my mouth.","[([3], [], -1)]"
"i happen to have a policy that goes along with a little bit of self-respect, which includes not letting a waiter intimidate me, i.e. make me feel bad asking for trivialities like water, or the check.","[([20], [], -1)]"
this place has got to be the best japanese restaurant in the new york area.,"[([1], [], 1)]"
food is great.,"[([0], [], 1)]"
service is top notch.,"[([0], [], 1)]"
i tend to judge a sushi restaurant by its sea urchin which was heavenly at sushi rose.,"[([9, 10], [], 1)]"
the sushi seemed pretty fresh and was adequately proportioned.,"[([1], [], 1), ([1], [], 1)]"
the rice to fish ration was also good--they didn't try to overpack the rice.,"[([1, 2, 3, 4], [], 1)]"
we took advanatage of the half price sushi deal on saturday so it was well worth it.,"[([5, 6, 7, 8], [], 1)]"
"in the evening, this place attracted a well dressed, with it, ny crowd","[([12], [], 1)]"
the food was well prepared and the service impecable.,"[([1], [], 1), ([7], [], 1)]"
the prix fixe menu is worth every penny and you get more than enough (both in quantity and quality).,"[([1, 2, 3], [], 1), ([1, 2, 3], [], 1), ([1, 2, 3], [], 1)]"
$6 and there is much tasty food all of it fresh and continually refilled.,"[([6], [], 1), ([6], [], 1), ([6], [], 1)]"
"i am not a vegetarian but, almost all the dishes were great.","[([9], [], 1)]"
"the food here is rather good, but only if you like to wait for it.","[([1], [], 1)]"
i like the somosas c chai and the chole but the d dhosas nd dhal were kinda dissapointing.,"[([3], [], 1), ([5], [], 1), ([8], [], 1), ([12], [], -1), ([14], [], -1)]"
"the service varys from day to day- sometimes they're very nice, and sometimes not.","[([1], [], -1)]"
"the kitchen however, is almost always slow.","[([1], [], -1)]"
"also, specify if you like your food spicy- its rather bland if you don't.","[([6], [], -1)]"
"the ambience is pretty and nice for conversation, so a casual lunch here would probably be best.","[([1], [], 1)]"
if you've ever been along the river in weehawken you have an idea of the top of view the chart house has to offer.,"[([17], [], 1)]"
add to that great service and great food at a reasonable price and you have yourself the beginning of a great evening.,"[([4], [], 1), ([7], [], 1), ([7], [], 1)]"
the lava cake dessert was incredible and i recommend it.,"[([1, 2, 3], [], 1)]"
"once you step into cosette you're miraculously in a small, off-the-beaten path parisian bistro.","[([4], [], 1)]"
"this tiny restaurant is as cozy as it gets, with that certain parisian flair.","[([2], [], 1)]"
"the food was average to above-average; the french onion soup filling yet not overly impressive, and the desserts not brilliant in any way.","[([1], [], 1), ([7, 8, 9], [], -1), ([7, 8, 9], [], 1), ([17], [], -1)]"
"however, go for the ambience and consider the f food ust a companion for a trip across the world!","[([4], [], 1), ([9], [], 0)]"
the pizza was delivered cold and the cheese wasn't even fully melted!,"[([1], [], -1), ([7], [], -1)]"
the pizza is overpriced and soggy.,"[([1], [], -1), ([1], [], -1)]"
"yes, they use fancy ingredients but even fancy ingredients don't make for good p pizza nless someone knows how to get the crust right.","[([4], [], 1), ([14], [], -1), ([22], [], -1)]"
i think i've had some the best meals of my life at minnow.,"[([7], [], 1)]"
"the seafood is amazing, there's a good wine list and the ever-changing m menu lways offers some great surprises.","[([1], [], 1), ([7, 8], [], 1), ([13], [], 1)]"
the combination of super-fresh ingredients in the dishes are unusual but really delicious.,"[([4], [], 1)]"
best pastrami i ever had and great portion without being ridiculous.,"[([1], [], 1), ([7], [], 1)]"
my wife had the fried shrimp which are huge and loved it.,"[([4, 5], [], 1), ([4, 5], [], 1)]"
"as a japanese native, i've lived in the tristate area for over 8 years, but i was just so amazed at this place","[([22], [], 1)]"
this place is the most japanese it can ever get.,"[([1], [], 1)]"
the signs the s specials menus food and even all the w waitstaff re all totally japanese.,"[([1], [], 1), ([4, 5], [], 1), ([6], [], 1), ([12], [], 1)]"
this place is worth an one-hour drive.,"[([1], [], 1)]"
"leon is an east village gem: casual but hip, with well prepared basic french bistro fare , good specials , a warm and livel atmosphere e.","[([0], [], 1), ([0], [], 1), ([18], [], 1), ([24], [], 1), ([13, 14, 15], [], 1)]"
"my wife and i always enjoy the young, not always well trained but nevertheless friendly, staff all of whom have a story.","[([15], [], 1)]"
decent wine at reasonable prices.,"[([1], [], 0), ([1], [], 1)]"
"everytime i decide to try another place on the ues, i get angry that i didn't just go to zucchero pomodori","[([19, 20], [], 1)]"
this is by far my favorite place in the neighborhood.,"[([6], [], 1)]"
"the service is excellent, the decor is great, and the food is delicious and comes in large portions","[([1], [], 1), ([5], [], 1), ([10], [], 1), ([17], [], 1)]"
i'm partial to the gnocchi,"[([4], [], 1)]"
this place is incredibly tiny.,"[([1], [], -1)]"
the hostess is rude to the point of being offensive.,"[([1], [], -1)]"
the food was bland oily.,"[([1], [], -1)]"
"we have been to this place many times, and always have great food w wine and service","[([12], [], 1), ([14], [], 1), ([16], [], 1)]"
"we were worried we would have trouble getting in, but somehow managed to have a short wait","[([16], [], 1)]"
as always we had a great glass of wine while we waited.,"[([6, 7, 8], [], 1)]"
"when we sat, we got great and fast service","[([8], [], 1)]"
the people that work there are always so friendly you forget you are in new york sometimes.,"[([1], [], 1)]"
make sure you try this place as often as you can.,"[([5], [], 1)]"
this is a fun restaurant to go to.,"[([4], [], 1)]"
the pizza is yummy and i like the atmoshpere,"[([1], [], 1), ([8], [], 1)]"
but the pizza is way to expensive.,"[([2], [], -1)]"
i went there for lunch and it was not as good as i expected from the reviews i read.,"[([4], [], -1)]"
sauce was watery and the food didn't have much flavor.,"[([0], [], -1), ([5], [], -1)]"
this place is great.,"[([1], [], 1)]"
the waitress was very patient with us and the food is phenomenal!,"[([1], [], 1), ([9], [], 1)]"
"service was prompt, friendly and great.","[([0], [], 1)]"
great pizza and fantastic service,"[([1], [], 1), ([4], [], 1)]"
there was a small wait but shorter than i expected.,"[([4], [], 1)]"
this is the best sushi in new york city - hands down.,"[([4], [], 1)]"
the place is small and cramped but the food is fantastic.,"[([1], [], -1), ([8], [], 1)]"
get the tuna of gari,"[([2, 3, 4], [], 1)]"
"planet thailand has always been a hit with me , i go there usually for the sushi which is great , the t thai food s excellent too .","[([16], [], 1), ([23, 24], [], 1), ([0, 1], [], 1)]"
"with the great variety on the menu , i eat here often and never get bored .","[([6], [], 1)]"
"the atmosphere isn't the greatest , but i suppose that's how they keep the prices down .","[([1], [], -1)]"
it's all about the food !!,"[([4], [], 1)]"
first it took us a long time to find the place,"[([10], [], -1)]"
"but when we looked at the menu there weren't a lot of choices, most of them were dumplings in the appetizer section.","[([6], [], -1)]"
"those rolls were big, but not good and sashimi wasn't fresh.","[([1], [], 0), ([1], [], -1), ([8], [], -1)]"
try the crunchy tuna it is to die for.,"[([2, 3], [], 1)]"
first went here to enjoy their garden terrace,"[([6, 7], [], 1)]"
"the food was amazing, and the service was prompt and helpful, but not over-bearing or rushed.","[([1], [], 1), ([6], [], 1)]"
"the steak tartare is a great bet, they fix it for you at the table.","[([1, 2], [], 1)]"
"admittedly some nights inside the restaurant were rather warm, but the open kitchen is part of the charm.","[([11, 12], [], 1), ([5], [], -1)]"
"great wine selection g gigondas s worth the price, and the house champagne is a great value.","[([1, 2], [], 1), ([4], [], 1), ([11, 12], [], 1)]"
"it may be a bit packed on weekends, but the vibe is good and it is the best french food you will find in the area.","[([10], [], 1), ([18, 19], [], 1)]"
"have recommended the place to friends, always gets good response.","[([3], [], 1)]"
"pizza - the only pizza in nyc that should not have additional toppings - the crust tastes like the best, freshly baked bread!","[([15], [], 1), ([4], [], 1)]"
i take all my nyc guests to vt's,"[([7], [], 1)]"
"not sure where the previous reviewer, lonk, dined, but saul is in a great neighborhood and has great food","[([14], [], 1), ([18], [], 1)]"
i'd highly recommend it for a special occasion -- it provides and intimate setting and nice service,"[([13], [], 1), ([16], [], 1)]"
i'm not sure where the other reviewers ate but it seems as if we visited two different restaurants because my friends and i all enjoy mizu very much... and we're repeat customers.,"[([25], [], 1)]"
make sure you have the spicy scallop roll . .,"[([5, 6, 7], [], 1)]"
"moules were excellent, lobster ravioli was very salty!","[([0], [], 1), ([3, 4], [], -1)]"
"took my mom for mother's day, and the maitre d' was pretty rude.","[([8, 9], [], -1)]"
tiny dessert was $8.00...just plain overpriced for what it is.,"[([1], [], -1), ([1], [], -1), ([1], [], -1)]"
the drinks are always welll made and wine selection is fairly priced.,"[([1], [], 1), ([7, 8], [], 1)]"
try their chef's specials - they are to die for.,"[([2, 3], [], 1)]"
"service is not exactly five star, but thats not really a big deal.","[([0], [], 0)]"
downstairs lounge is always a good attraction,"[([0, 1], [], 1)]"
"raga's is a romantic, cozy restaurant.","[([0], [], 1)]"
the exotic food is beautifully presented and is a delight in delicious combinations.,"[([1, 2], [], 1), ([1, 2], [], 1)]"
the staff is incredibly helpful and attentive.,"[([1], [], 1)]"
the bar is very well stocked with interesting beers and well priced wines,"[([1], [], 1), ([8], [], 1), ([12], [], 1)]"
"when we stumbled on leon we thought that we had found quite the gem but, we were certainly wrong.","[([4], [], -1)]"
"the waitress moved our table practically into the bathroom and when we asked to cancel our dinner orders because we did not want to eat sitting on the toilet, we were told no...","[([1], [], -1)]"
rude service medicore f food .there are tons of restaurants in ny...stay away from this one,"[([1], [], -1), ([4], [], 0)]"
i had a grat time at jekyll and hyde,"[([6, 7, 8], [], 1)]"
i loved everythig about it-especially the shows and actors,"[([6], [], 1), ([8], [], 1)]"
our server was very helpful and friendly.,"[([1], [], 1)]"
the food was good too.,"[([1], [], 1)]"
the tuna and wasabe potatoes are excellent.,"[([1], [], 1), ([3, 4], [], 1)]"
the outdoor atmosphere of sitting on the sidewalk watching the world go by 50 feet away on 6th avenue on a cool evening was wonderful.,"[([1, 2], [], 1)]"
service was prompt and courteous.,"[([0], [], 1)]"
great service great f food,"[([1], [], 1), ([4], [], 1)]"
"the pizza is delicious - they use fresh mozzarella instead of the cheap, frozen, shredded cheese common to most pizzaria's.","[([1], [], 1), ([7, 8], [], 1)]"
"two complaints- their appetizer selection stinks, it would be nice to get some mozzarella sticks on the menu.","[([3, 4], [], -1)]"
wait staff is blantently unappreciative of your business but its the best pie on the uws!,"[([0, 1], [], -1), ([12], [], 1)]"
by far the best salad i have had in a fast food restaurant.,"[([4], [], 1)]"
fine dining restaurant quality.,"[([1], [], 1)]"
"on a recent sunday afternoon, a friend and i accidently found this great restaurant on our way to see the pulitzer prize winning play doubt.","[([13], [], 1)]"
"the chicken pot pie is excpetiona, the cheeseburger huge and delictable, and the service professional wan warm.","[([1, 2, 3], [], 1), ([7], [], 1), ([7], [], 1), ([13], [], 1)]"
the staff is no nonsense.,"[([1], [], 1)]"
the food options rule.,"[([1], [], 1)]"
when i lived upstate for a while i would buy freeze the bagels and they would still be better than any else.,"[([12], [], 1)]"
worth visiting the 1st ave spot because it is the original store.,"[([3, 4, 5], [], 1)]"
"he served me an uni hand roll which i never had before, and let me tell you...it was heaven!","[([4, 5, 6], [], 1)]"
the sake menu should not be overlooked!,"[([1, 2], [], 1)]"
try the lobster teriyaki and the rose special roll,"[([2, 3], [], 1), ([6, 7, 8], [], 1)]"
"service was very good - prompt, attentive and non-intrusive.","[([0], [], 1)]"
"food was very good as well, considering that we tried the budget selection (though i wish the pork belly that i ordered was roasted a bit longer, so that fat was more of a melt-in-your-mouth experience).","[([0], [], 1), ([17, 18], [], -1)]"
wine list selection is good and wine-by-the-glass was generously filled to the top.,"[([0, 1, 2], [], 1), ([6], [], 1)]"
traditional french decour was pleasant though the hall was rather noisy - the restaurant was full and we had to raise our voices to be able to maintain a conversation.,"[([0, 1, 2], [], 1), ([7], [], -1)]"
"i've been to at cafe spice probably 5-8 times, it is probably still the best indian restaurant around union square.","[([4, 5], [], 1)]"
"to sum it up: service varies from good to mediorce, depending on which waiter you get; generally it is just average ok.","[([4], [], 0)]"
"seating is always prompt, though the restaurant does fill up in the evening.","[([0], [], 1)]"
"food is usually very good, though ocasionally i wondered about freshmess of raw vegatables in side orders .","[([0], [], 1), ([12, 13, 14, 15, 16], [], -1)]"
"the decor is vibrant and eye-pleasing with several semi-private boths on the right side of the dining hall, which are great for a date.","[([1], [], 1), ([8, 9], [], 1)]"
i have never been disappointed in the red eye,"[([7, 8], [], 1)]"
"the first time i went, and was completely taken by the live jazz band and atmosphere i ordered the lobster cobb salad.","[([11, 12, 13], [], 1), ([15], [], 1)]"
it's simply the best meal in nyc.,"[([4], [], 1)]"
you cannot go wrong at the red eye grill,"[([6, 7, 8], [], 1)]"
"if we were to move from the upper east side, we would genuinely miss this restaurant","[([15], [], 1)]"
the restaurant is cute but not upscale.,"[([1], [], 0)]"
the food is a diamond in rough -- the food is delicious and homemade with the perfect balance of herbs and tomatoes,"[([1], [], 1), ([17, 18, 19, 20, 21], [], 1)]"
we had a great time at the jekyll and hyde pub last night.,"[([7, 8, 9, 10], [], 1)]"
after really enjoying ourselves at the bar we sat down at a table and had dinner.,"[([6], [], 1)]"
the server was really cool and served us our food and drinks with a smile.,"[([1], [], 1)]"
the place's decor and hidden bathrooms made for a good laugh.,"[([2], [], 1), ([4, 5], [], 1)]"
i highly recommend visiting this restaurant and having dinner and drinks!,"[([5], [], 1)]"
"if you are the type of person who likes being scared and entertained, this is a great place to go and eat.","[([17], [], 1)]"
"my husband and i thougt it would be great to go to the jekyll and hyde pub for our anniversary, and to our surprise it was fantastic.","[([13, 14, 15, 16], [], 1)]"
"the have over 100 different beers to offer thier guest so that made my husband very happy and the food was delicious, if i must recommend a dish it must be the pumkin tortelini","[([5], [], 1), ([19], [], 1), ([32, 33], [], 1)]"
the entertainment was great they have shows that go on through out the dinner.,"[([1], [], 1)]"
"please take my advice, go and try this place","[([8], [], 1)]"
the bagel was huge.,"[([1], [], 1)]"
the workers there also absolutely load the bagel with cream cheese (gets a little messy).,"[([7], [], -1)]"
this was my frist time at cafe st. bart's and i must say how delicous the food and the service was.,"[([16], [], 1), ([19], [], 1)]"
i have to highly recommend the lobster roll - not to much mayo; you can tell it was a fresh lobster,"[([6, 7], [], 1), ([20], [], 1)]"
other guests enjoyed pizza s santa fe chopped salad nd fish and chips,"[([3], [], 1), ([5, 6, 7, 8], [], 1), ([10, 11, 12], [], 1)]"
i highly recommend cafe st. bart's for their food the a ambience nd wonderful service,"[([8], [], 1), ([11], [], 1), ([14], [], 1)]"
all the staff is absolutely professional!!,"[([2], [], 1)]"
this restaurant was way overhyped.,"[([1], [], -1)]"
my chow fun and chow see was really bland and oily.,"[([1, 2, 3, 4, 5], [], -1)]"
the scallion pancakes and fried dumplings were nothing out of the ordinary.,"[([1, 2], [], 0), ([4, 5], [], 0)]"
the service was the only thing good about this restaurant,"[([1], [], 1), ([9], [], -1)]"
"it's boring on the inside, and our sushi was pretty below average... the tuna was soggy and the other rolls had no flavor.","[([7], [], -1), ([13], [], -1), ([19], [], -1)]"
their pad penang is delicious and everything else is fantastic.,"[([1, 2], [], 1)]"
the price is reasonable although the service is poor.,"[([6], [], -1)]"
fresh restaurant was amazing........ food was delicious and of course fresh.,"[([0, 1], [], 1), ([4], [], 1)]"
hats off to the chef,"[([4], [], 1)]"
"the salads are delicious, both refreshing and very spicy.","[([1], [], 1)]"
we had pam's special fried fish and it was amazing.,"[([2, 3, 4, 5], [], 1)]"
great vibe lots of people.,"[([1], [], 1)]"
"i didn't complain, i liked the atmosphere so much.","[([6], [], 1)]"
"ambience is so cute and quaint, good for business although we were there on vacation.","[([0], [], 1)]"
salads were fantastic.,"[([0], [], 1)]"
although we were looking for regular lettuce and some walnuts the salads we got were great.,"[([11], [], 1)]"
ingredients are organic which is a real plus for me.,"[([0], [], 1)]"
"this is some really good, inexpensive sushi","[([6], [], 1), ([6], [], 1)]"
the spicy tuna roll is huge and probably the best that i've had at this price range.,"[([1, 2, 3], [], 1), ([1, 2, 3], [], 1), ([1, 2, 3], [], 1)]"
the yellowtail was particularly good as well.,"[([1], [], 1)]"
i have reservations about the all you can eat deal however -- the choices are fairly limited and you can probably order more food than you can eat for less than $18 by just going off the menu.,"[([5, 6, 7, 8, 9], [], -1), ([5, 6, 7, 8, 9], [], -1)]"
"in any event, this is a place i'll be sure to stop by again when i'm in this part of town.","[([6], [], 1)]"
big wong gets big ups for a fine establishment.,"[([0, 1], [], 1)]"
"they have it all -- great price, food and s service","[([7], [], 1), ([10], [], 1)]"
the atmosphere is noisy and the waiters are literally walking around doing things as fast as they can.,"[([1], [], -1), ([6], [], 1)]"
and it all comes at a very reasonable price ( congee noodles and r rice dishes re no more than $3-6 each).,"[([10], [], 1), ([11], [], 1), ([14, 15], [], 1)]"
the takeout is great too since they give high quality tupperware as well.,"[([1], [], 1)]"
this place is always very crowded and popular.,"[([1], [], 1)]"
enjoyed a very nice caesar salad while my wife had arugula and goat cheese ...both very tasty.,"[([4, 5], [], 1), ([10, 11, 12, 13], [], 1)]"
we both opted for a pasta dish and they were served timely and fresh.,"[([5, 6], [], 1)]"
we concluded with tiramisu chocolate cake both were delicious.,"[([3, 4, 5], [], 1)]"
i recently went to this restaurant with some co-workers for lunch and had an amazing time.,"[([5], [], 1)]"
"the staff was accomodating, the food was absolutely delicious and the place is lovely.","[([1], [], 1), ([5], [], 1), ([11], [], 1)]"
we even had a visit from the manager who wanted to make sure we were enjoying ourselves.,"[([7], [], 1)]"
sometimes i get good food and ok service,"[([4], [], 1), ([7], [], 0)]"
sometimes i get bad food and bad service sometimes i get good g good nd bad s service,"[([4], [], -1), ([7], [], -1), ([17], [], -1), ([13], [], 1)]"
the place is a bistro which means: simple dishes and wine served efficiently in a bustling atmosphere,"[([8], [], 1), ([10], [], 1), ([16], [], 1)]"
and where does patis go wrong; no where.,"[([3], [], 1)]"
and evaluated on those terms pastis is simply wonderful.,"[([5], [], 1)]"
right off the l in brooklyn this is a nice cozy place with good pizza,"[([14], [], 1), ([11], [], 1)]"
mine was a little burnt but still delicious with goat cheese and panchetta ( raddichio was kind of bitter though).,"[([14], [], -1)]"
my friend got the mushroom pizza which tasted better.,"[([4, 5], [], 1)]"
the sangria was pretty tasty and good on a hot muggy day.,"[([1], [], 1)]"
kind of a small place but i guess if they are not too busy might be able to fit a group or kids.,"[([4], [], 0)]"
i started out with a bombay beer which was big enough for two.,"[([5, 6], [], 1)]"
"service was slow, but the people were friendly.","[([0], [], -1), ([5], [], 1)]"
it's a nice place to relax and have conversation.,"[([3], [], 1)]"
the food is authentic italian - delicious!,"[([1], [], 1)]"
"pizza is terrific, as is homemade pasta .","[([0], [], 1), ([5, 6], [], 1)]"
"ambience is delightful, service impeccable.","[([0], [], 1), ([3], [], 1)]"
i'm still mad that i had to pay for lousy food,"[([10], [], -1)]"
the hanger steak was like rubber and the tuna was flavorless not to mention it tasted like it had just been thawed.,"[([1, 2], [], -1), ([8], [], -1)]"
service was also horrible and the ambience is not that great.,"[([0], [], -1), ([6], [], -1)]"
i go and eat out at many different restaurants and this is one place you have go and try.,"[([13], [], 1)]"
this is my first time writing a review for a restaurant because the food and service was excellent.,"[([13], [], 1), ([15], [], 1)]"
the filet mignon dish was superb!,"[([1, 2, 3], [], 1)]"
it's a small cute restaurant,"[([4], [], 1)]"
i absolutely love this place !!,"[([4], [], 1)]"
i like the ambience it's very dark and original.,"[([3], [], 1)]"
the sushi is amazing!!!,"[([1], [], 1)]"
very affordable and excellent ambient,"[([4], [], 1)]"
we ordered some beef and noodle soup dishes from the thai section of the menu but nothing we got was thai.,"[([3, 4, 5, 6, 7], [], -1)]"
we won't go to this place again for a good meal,"[([10], [], -1)]"
"however, i think this place is a good hang out spot.","[([4], [], 1)]"
my girlfriend and i stumbled onto this hopping place the other night and had a great time!,"[([8], [], 1)]"
